{
  "$schema": "https://json-schema.org/draft/2020-12/schema",
  "$id": "https://savi.seo/contracts/sync/v1/heartbeat.response.schema.json",
  "title": "POST /api/v1/instances/heartbeat - response 200",
  "type": "object",
  "required": ["server_time", "instance_status", "policy", "notices"],
  "properties": {
    "server_time": {
      "type": "string",
      "pattern": "^[0-9]{4}-[0-9]{2}-[0-9]{2}T[0-9]{2}:[0-9]{2}:[0-9]{2}(\\.[0-9]{1,6})?(Z|[+-][0-9]{2}:[0-9]{2})$"
    },
    "instance_status": { "enum": ["active", "suspended", "revoked"] },
    "policy": {
      "type": "object",
      "required": ["heartbeat_seconds", "ingest_seconds", "max_batch_events", "sync_enabled"],
      "properties": {
        "heartbeat_seconds": { "type": "integer", "minimum": 1 },
        "ingest_seconds": { "type": "integer", "minimum": 1 },
        "max_batch_events": { "type": "integer", "minimum": 1, "maximum": 500 },
        "sync_enabled": { "type": "boolean" },
        "config_locked": { "type": "boolean" },
        "allow_local_cli": { "type": "boolean" },
        "access": {
          "type": ["object", "null"],
          "additionalProperties": false,
          "properties": {
            "default_databases": {
              "type": ["array", "null"],
              "maxItems": 200,
              "uniqueItems": true,
              "items": { "type": "string", "pattern": "^[0-9a-f]{8}-[0-9a-f]{4}-[0-9a-f]{4}-[0-9a-f]{4}-[0-9a-f]{12}$" }
            },
            "user_databases": {
              "type": "object",
              "maxProperties": 500,
              "propertyNames": { "pattern": "^[0-9a-f]{32}$" },
              "additionalProperties": {
                "type": "array",
                "maxItems": 200,
                "uniqueItems": true,
                "items": { "type": "string", "pattern": "^[0-9a-f]{8}-[0-9a-f]{4}-[0-9a-f]{4}-[0-9a-f]{4}-[0-9a-f]{12}$" }
              }
            }
          }
        },
        "ai": {
          "type": ["object", "null"],
          "additionalProperties": false,
          "properties": {
            "allowed_providers": {
              "type": ["array", "null"],
              "items": { "enum": ["claude", "gemini", "openai"] },
              "uniqueItems": true
            },
            "user_monthly_usd": { "type": ["string", "null"], "pattern": "^[0-9]{1,8}(\\.[0-9]{1,4})?$" },
            "provider_monthly_usd": {
              "type": "object",
              "propertyNames": { "enum": ["claude", "gemini", "openai"] },
              "additionalProperties": { "type": "string", "pattern": "^[0-9]{1,8}(\\.[0-9]{1,4})?$" }
            },
            "user_overrides": {
              "type": "object",
              "maxProperties": 500,
              "propertyNames": { "pattern": "^[0-9a-f]{32}$" },
              "additionalProperties": { "type": "string", "pattern": "^[0-9]{1,8}(\\.[0-9]{1,4})?$" }
            }
          }
        },
        "identity_mode": { "enum": ["pseudonym", "named"] }
      }
    },
    "notices": {
      "type": "array",
      "items": {
        "type": "object",
        "required": ["code", "severity", "message"],
        "properties": {
          "code": { "type": "string", "pattern": "^[a-z0-9_]{1,64}$" },
          "severity": { "enum": ["info", "warning", "critical"] },
          "message": { "type": "string", "maxLength": 500 }
        }
      }
    },
    "ai": { "type": ["object", "null"] }
  }
}
