{
  "server_time": "2026-09-14T15:00:01Z",
  "instance_status": "suspended",
  "policy": {
    "heartbeat_seconds": 300,
    "ingest_seconds": 300,
    "max_batch_events": 500,
    "sync_enabled": false
  },
  "notices": [
    {
      "code": "fingerprint_mismatch",
      "severity": "critical",
      "message": "La huella de la instancia cambió; un administrador debe confirmarla."
    }
  ]
}
